{
  "$schema": "../schemas/drift-rules-v1.schema.json",
  "format": "drift-rules/v1",
  "version": "1.0.0",
  "confidence": {
    "syntheticFailing": 0.8,
    "syntheticHalfLife": 20,
    "ruleOfThree": 3
  },
  "rules": [
    {
      "id": "DRIFT-REQ-PATH-ADDED",
      "kind": "path.added",
      "direction": "request",
      "structural": "safe",
      "verifiable": false,
      "additive": true,
      "rationale": "A new path adds functionality; existing clients do not call it."
    },
    {
      "id": "DRIFT-REQ-PATH-REMOVED",
      "kind": "path.removed",
      "direction": "request",
      "structural": "dangerous",
      "verifiable": true,
      "additive": false,
      "rationale": "Clients still calling the path will get an error; a recorded call to it proves the break."
    },
    {
      "id": "DRIFT-REQ-OPERATION-ADDED",
      "kind": "operation.added",
      "direction": "request",
      "structural": "safe",
      "verifiable": false,
      "additive": true,
      "rationale": "A new operation adds functionality; existing clients do not call it."
    },
    {
      "id": "DRIFT-REQ-OPERATION-REMOVED",
      "kind": "operation.removed",
      "direction": "request",
      "structural": "dangerous",
      "verifiable": true,
      "additive": false,
      "rationale": "Clients still calling the operation will get an error; a recorded call to it proves the break."
    },
    {
      "id": "DRIFT-REQ-OPERATION-DEPRECATED",
      "kind": "operation.deprecated",
      "direction": "request",
      "structural": "safe",
      "verifiable": false,
      "additive": true,
      "rationale": "Deprecation announces a future removal but does not change behaviour."
    },
    {
      "id": "DRIFT-REQ-PATH-PARAM-RENAMED",
      "kind": "path.param.renamed",
      "direction": "request",
      "structural": "safe",
      "verifiable": false,
      "additive": false,
      "rationale": "Path parameter names are not sent on the wire; only the position matters."
    },
    {
      "id": "DRIFT-REQ-PARAM-ADDED-REQUIRED",
      "kind": "param.added.required",
      "direction": "request",
      "structural": "dangerous",
      "verifiable": true,
      "additive": false,
      "rationale": "Existing clients do not send the new parameter, so the server will reject their requests."
    },
    {
      "id": "DRIFT-REQ-PARAM-ADDED-OPTIONAL",
      "kind": "param.added.optional",
      "direction": "request",
      "structural": "safe",
      "verifiable": false,
      "additive": true,
      "rationale": "Existing clients can keep omitting an optional parameter."
    },
    {
      "id": "DRIFT-REQ-PARAM-REMOVED",
      "kind": "param.removed",
      "direction": "request",
      "structural": "dangerous",
      "verifiable": false,
      "additive": false,
      "rationale": "Clients may rely on the parameter's effect; servers usually ignore unknown parameters, so no sample can prove the break."
    },
    {
      "id": "DRIFT-REQ-PARAM-MADE-REQUIRED",
      "kind": "param.made_required",
      "direction": "request",
      "structural": "dangerous",
      "verifiable": true,
      "additive": false,
      "rationale": "Clients that omit the parameter will be rejected."
    },
    {
      "id": "DRIFT-REQ-PARAM-MADE-OPTIONAL",
      "kind": "param.made_optional",
      "direction": "request",
      "structural": "safe",
      "verifiable": false,
      "additive": true,
      "rationale": "Every request that was valid still is."
    },
    {
      "id": "DRIFT-REQ-PARAM-LOCATION-CHANGED",
      "kind": "param.location_changed",
      "direction": "request",
      "structural": "dangerous",
      "verifiable": true,
      "additive": false,
      "rationale": "Clients still send the parameter in its old location, where the server no longer reads it."
    },
    {
      "id": "DRIFT-REQ-PARAM-DEPRECATED",
      "kind": "param.deprecated",
      "direction": "request",
      "structural": "safe",
      "verifiable": false,
      "additive": true,
      "rationale": "Deprecation announces a future removal but does not change behaviour."
    },
    {
      "id": "DRIFT-REQ-REQUEST-BODY-ADDED-REQUIRED",
      "kind": "request.body.added.required",
      "direction": "request",
      "structural": "dangerous",
      "verifiable": true,
      "additive": false,
      "rationale": "Existing clients send no body, so the server will reject their requests."
    },
    {
      "id": "DRIFT-REQ-REQUEST-BODY-ADDED-OPTIONAL",
      "kind": "request.body.added.optional",
      "direction": "request",
      "structural": "safe",
      "verifiable": false,
      "additive": true,
      "rationale": "Existing clients can keep sending no body."
    },
    {
      "id": "DRIFT-REQ-REQUEST-BODY-REMOVED",
      "kind": "request.body.removed",
      "direction": "request",
      "structural": "dangerous",
      "verifiable": false,
      "additive": false,
      "rationale": "Clients still send a body the server no longer reads; its effect is lost, which validation cannot show."
    },
    {
      "id": "DRIFT-REQ-REQUEST-BODY-MADE-REQUIRED",
      "kind": "request.body.made_required",
      "direction": "request",
      "structural": "dangerous",
      "verifiable": true,
      "additive": false,
      "rationale": "Clients that send no body will be rejected."
    },
    {
      "id": "DRIFT-REQ-REQUEST-BODY-MADE-OPTIONAL",
      "kind": "request.body.made_optional",
      "direction": "request",
      "structural": "safe",
      "verifiable": false,
      "additive": true,
      "rationale": "Every request that was valid still is."
    },
    {
      "id": "DRIFT-REQ-SECURITY-REQUIREMENT-ADDED",
      "kind": "security.requirement.added",
      "direction": "request",
      "structural": "dangerous",
      "verifiable": false,
      "additive": false,
      "rationale": "Clients without the new credentials or scopes will be refused; recorded credentials are redacted, so this is not proven by samples."
    },
    {
      "id": "DRIFT-REQ-SECURITY-REQUIREMENT-REMOVED",
      "kind": "security.requirement.removed",
      "direction": "request",
      "structural": "safe",
      "verifiable": false,
      "additive": false,
      "rationale": "Every way of calling that worked still works."
    },
    {
      "id": "DRIFT-RES-RESPONSE-STATUS-ADDED",
      "kind": "response.status.added",
      "direction": "response",
      "structural": "dangerous",
      "verifiable": false,
      "additive": false,
      "rationale": "Clients may not handle a success status they have never seen; this is behavioural and not provable by validation."
    },
    {
      "id": "DRIFT-RES-RESPONSE-ERROR-STATUS-ADDED",
      "kind": "response.error_status.added",
      "direction": "response",
      "structural": "safe",
      "verifiable": false,
      "additive": false,
      "rationale": "Clients already have to handle error statuses in general."
    },
    {
      "id": "DRIFT-RES-RESPONSE-STATUS-REMOVED",
      "kind": "response.status.removed",
      "direction": "response",
      "structural": "dangerous",
      "verifiable": false,
      "additive": false,
      "rationale": "Clients waiting for this status will not get it; this is behavioural and not provable by validation."
    },
    {
      "id": "DRIFT-REQ-MEDIA-TYPE-ADDED",
      "kind": "media_type.added",
      "direction": "request",
      "structural": "safe",
      "verifiable": false,
      "additive": true,
      "rationale": "The server accepts an additional format; existing clients are unaffected."
    },
    {
      "id": "DRIFT-RES-MEDIA-TYPE-ADDED",
      "kind": "media_type.added",
      "direction": "response",
      "structural": "dangerous",
      "verifiable": false,
      "additive": false,
      "rationale": "The server may answer in a format existing clients cannot parse."
    },
    {
      "id": "DRIFT-REQ-MEDIA-TYPE-REMOVED",
      "kind": "media_type.removed",
      "direction": "request",
      "structural": "dangerous",
      "verifiable": true,
      "additive": false,
      "rationale": "Clients still sending this format will be rejected; a recorded request in it proves the break."
    },
    {
      "id": "DRIFT-RES-MEDIA-TYPE-REMOVED",
      "kind": "media_type.removed",
      "direction": "response",
      "structural": "dangerous",
      "verifiable": false,
      "additive": false,
      "rationale": "Clients asking for this format will no longer get it."
    },
    {
      "id": "DRIFT-REQ-SCHEMA-PROPERTY-ADDED-REQUIRED",
      "kind": "schema.property.added.required",
      "direction": "request",
      "structural": "dangerous",
      "verifiable": true,
      "additive": false,
      "rationale": "Existing clients do not send the new property, so the server will reject their requests."
    },
    {
      "id": "DRIFT-RES-SCHEMA-PROPERTY-ADDED-REQUIRED",
      "kind": "schema.property.added.required",
      "direction": "response",
      "structural": "safe",
      "verifiable": true,
      "additive": false,
      "rationale": "Clients receive one more property. It is proven breaking only if the old schema forbade additional properties."
    },
    {
      "id": "DRIFT-REQ-SCHEMA-PROPERTY-ADDED-OPTIONAL",
      "kind": "schema.property.added.optional",
      "direction": "request",
      "structural": "safe",
      "verifiable": true,
      "additive": true,
      "rationale": "Existing clients can keep omitting an optional property."
    },
    {
      "id": "DRIFT-RES-SCHEMA-PROPERTY-ADDED-OPTIONAL",
      "kind": "schema.property.added.optional",
      "direction": "response",
      "structural": "safe",
      "verifiable": true,
      "additive": false,
      "rationale": "Clients receive one more property. It is proven breaking only if the old schema forbade additional properties."
    },
    {
      "id": "DRIFT-REQ-SCHEMA-PROPERTY-REMOVED",
      "kind": "schema.property.removed",
      "direction": "request",
      "structural": "dangerous",